{
  "wireframe_id": "01_landing",
  "wireframe_path": ".claude/wireframes/01_landing.xml",
  "source_component_path": "frontend/src/_reference/migration/phase3/phase3-batch2/HeroLanding.tsx",
  "screen_component_path": "frontend/src/screens/01_landing/HeroLanding.tsx",
  "route": "/",
  "notes": "Paired package for wireframe-to-TSX comparison. Runtime canonical route is /.",
  "local_wireframe_path": "frontend/src/screens/01_landing/01_landing.wireframe.xml"
}
